{
  "$schema": "https://json-schema.org/draft/2020-12/schema",
  "$id": "https://schemas.iroute.dev/v1/model-gateway-request.schema.json",
  "title": "ModelGatewayRequest",
  "type": "object",
  "additionalProperties": false,
  "required": ["capability", "input", "context", "maxOutputTokens"],
  "properties": {
    "capability": { "type": "string", "minLength": 1 },
    "input": true,
    "context": true,
    "maxOutputTokens": { "type": "integer", "minimum": 1 },
    "correlationId": { "type": ["string", "null"], "maxLength": 200 },
    "profileId": { "type": ["string", "null"], "maxLength": 200 },
    "deadlineMilliseconds": { "type": ["integer", "null"], "minimum": 1 },
    "minimumQuality": { "type": ["number", "null"], "minimum": 0, "maximum": 1 },
    "maximumCost": { "type": ["number", "null"], "minimum": 0 },
    "allowedRegions": {
      "type": ["array", "null"],
      "uniqueItems": true,
      "maxItems": 64,
      "items": { "type": "string", "minLength": 1, "maxLength": 200 }
    },
    "requiredResidency": { "type": ["string", "null"], "maxLength": 200 },
    "maximumAttempts": { "type": ["integer", "null"], "minimum": 1, "maximum": 10 },
    "tenantId": { "type": "string", "minLength": 1, "default": "local" }
  }
}
